{
  "id": "BENCH-T6-cadeia-vazia",
  "quando": "2026-10-05T19:42:11-03:00",
  "sujeito": {
    "referencia": "pseudo:7f3a9c",
    "recebeu_copia": true,
    "em": "2026-10-05T19:42:12-03:00"
  },
  "decisao": {
    "o_que": "classificação de risco para liberação de crédito",
    "efeito": "limite reduzido de R$ 2.000 para R$ 400 por 90 dias",
    "valor": 400
  },
  "cadeia": [],
  "criterio": {
    "regra_publicada": "https://exemplo.org/criterios/credito/v3.2",
    "versao": "3.2",
    "sha256": "a1c3e5079b2d4f6081a3c5e709b1d3f5a7c9e1b3d5f7091a3c5e709b1d3f5a7c"
  },
  "responsavel": {
    "entidade": "Comitê de Crédito — Unidade 4",
    "contato": "recurso@exemplo.org",
    "humano_revisou": false
  },
  "fronteira": {
    "e_caso_de_fronteira": true,
    "margem": 0.012,
    "nota": "escore 0,588 contra limiar 0,600 — dentro da faixa de revisão"
  },
  "derrubar": {
    "como": "contestação por formulário ou presencialmente, sem custo",
    "prazo_dias": 30,
    "suspende_efeito": true,
    "obriga_exame": true
  },
  "ausencias": [
    {
      "campo": "renda informal",
      "motivo": "nao_coletado",
      "impacto": "pode subestimar capacidade de pagamento"
    },
    {
      "campo": "origem do endereço anterior",
      "motivo": "indisponivel",
      "impacto": "nenhum declarado"
    }
  ],
  "custo": {
    "recai_sobre": "sistema",
    "reparacao": "restituição de tarifas e correção do registro em 5 dias úteis, com aviso ao sujeito",
    "custo_exame_estimado": 18.0,
    "custo_erro_estimado": 740.0,
    "unidade": "BRL"
  }
}